origin_airport_name,destination_airport_name,count
Perth International Airport,London Heathrow Airport,18
Rome–Fiumicino Leonardo da Vinci International Airport,Dallas Fort Worth International Airport,18
Adolfo Suárez Madrid–Barajas Airport,Aeropuerto Internacional Miguel Hidalgo,18
Aeropuerto Internacional Miguel Hidalgo,Adolfo Suárez Madrid–Barajas Airport,18
Humberto Delgado Airport (Lisbon Portela Airport),Deputado Luiz Eduardo Magalhães International Airport,18
Tan Son Nhat International Airport,Incheon International Airport,36
