origin_airport_name,destination_airport_name,count
Josep Tarradellas Barcelona-El Prat Airport,Shenzhen Bao'an International Airport,17
Tan Son Nhat International Airport,San Francisco International Airport,17
Kuala Lumpur International Airport,Sydney Kingsford Smith International Airport,17
London Heathrow Airport,Pittsburgh International Airport,17
Antalya International Airport,Vnukovo International Airport,17
Chicago O'Hare International Airport,Los Angeles / Tom Bradley International Airport,17
Shanghai Pudong International Airport,Kuala Lumpur International Airport,5
